Number,text,gender,age,country
0,The delicious aroma of freshly baked bread filled the bakery.,MALE,29,ZA
1,I enjoy taking long walks in the peaceful countryside.,FEMALE,42,NG
2,The suspenseful novel kept me on the edge of my seat.,FEMALE,29,VN
3,They celebrated their anniversary with a romantic candlelit dinner.,FEMALE,20,PK
4,The diligent student earned top marks for her exceptional work.,MALE,30,PK
5,The rhythmic beat of the drums echoed through the concert hall.,MALE,18,IN
6,The curious child eagerly explored the vast museum exhibits.,FEMALE,22,KE
